<?xml version="1.0" encoding="UTF-8"?>
<xs:schema xmlns:xs="http://www.w3.org/2001/XMLSchema">
    
    <xs:element name="courses">
        <xs:complexType>
            <xs:sequence>
                <xs:element name="course" maxOccurs="unbounded">
                    <xs:complexType>
                        <xs:sequence>
                            <xs:element name="title" type="xs:string"/>
                            <xs:element name="instructor" type="xs:string"/>
                            <xs:element name="price">
                                <xs:simpleType>
                                    <xs:restriction base="xs:decimal">
                                        <xs:minInclusive value="0"/>
                                    </xs:restriction>
                                </xs:simpleType>
                            </xs:element>
                            <xs:element name="rating">
                                <xs:simpleType>
                                    <xs:restriction base="xs:decimal">
                                        <xs:minInclusive value="0"/>
                                        <xs:maxInclusive value="5.0"/>
                                    </xs:restriction>
                                </xs:simpleType>
                            </xs:element>
                        </xs:sequence>
                        <xs:attribute name="id" type="xs:string" use="required"/>
                    </xs:complexType>
                </xs:element>
            </xs:sequence>
        </xs:complexType>
    </xs:element>
    
</xs:schema>
